{
  "$schema": "http://json-schema.org/draft-07/schema#",
  "title":   "Semantic Packet Schema — Chat Review Bridge",
  "version": "1.0",
  "description": "Schema untuk artefak semantik yang diekspor dari pipeline untuk direview di room chat. Packet ini bukan JSON mentah — ia adalah unit keputusan yang bisa dipahami tanpa membuka file lain.",
  "type": "object",
  "required": [
    "packet_id", "packet_type", "target_id",
    "scope", "decision_prompt", "context", "decision_options"
  ],
  "properties": {
    "packet_id": {
      "type": "string",
      "description": "Unique identifier untuk packet ini",
      "minLength": 1
    },
    "packet_type": {
      "type": "string",
      "enum": [
        "framing_note",
        "terminology_note",
        "caution_note",
        "interpretation_paragraph",
        "executive_framing",
        "closing_paragraph",
        "proxy_recommendation",
        "gap_acknowledgement"
      ],
      "description": "Jenis semantic packet — menentukan konteks review"
    },
    "target_id": {
      "type": "string",
      "description": "ID target yang akan diubah jika patch diterima (e.g. 'bab_4', 'bab_7.core_claim')"
    },
    "scope": {
      "type": "object",
      "required": ["allowed_changes", "forbidden_changes"],
      "properties": {
        "allowed_changes": {
          "type": "array",
          "items": { "type": "string" },
          "description": "Apa yang boleh diubah oleh reviewer"
        },
        "forbidden_changes": {
          "type": "array",
          "items": { "type": "string" },
          "description": "Apa yang TIDAK boleh diubah — validator akan menolak patch yang melanggar ini"
        }
      }
    },
    "decision_prompt": {
      "type": "string",
      "description": "Pertanyaan jelas yang harus dijawab reviewer — harus bisa dipahami tanpa membuka file lain",
      "minLength": 10
    },
    "context": {
      "type": "object",
      "required": ["current_text", "source", "confidence", "applicability_context"],
      "properties": {
        "current_text": {
          "type": "string",
          "description": "Teks saat ini yang akan diulas"
        },
        "source": {
          "type": "string",
          "description": "Dari mana teks/suggestion ini berasal (rule_id, engine, dll)"
        },
        "confidence": {
          "type": "number",
          "minimum": 0,
          "maximum": 1,
          "description": "Confidence engine dalam suggestion ini"
        },
        "relevant_history": {
          "type": "string",
          "description": "Keputusan historis yang relevan dari review sebelumnya (boleh kosong)"
        },
        "applicability_context": {
          "type": "string",
          "description": "Label konteks — keputusan review ini berlaku untuk konteks ini saja",
          "minLength": 1
        },
        "program_code": {
          "type": "string",
          "description": "Kode program"
        }
      }
    },
    "decision_options": {
      "type": "array",
      "items": {
        "type": "string",
        "enum": ["accept", "reject", "revise_with_text"]
      },
      "minItems": 1,
      "description": "Opsi keputusan yang tersedia untuk reviewer"
    },
    "decision": {
      "type": ["string", "null"],
      "enum": ["accept", "reject", "revise_with_text", null],
      "description": "Keputusan reviewer — null jika belum direview"
    },
    "revised_text": {
      "type": ["string", "null"],
      "description": "Teks revisi dari reviewer — wajib ada jika decision = revise_with_text"
    },
    "reviewer_note": {
      "type": ["string", "null"],
      "description": "Catatan bebas dari reviewer"
    },
    "reviewed_at": {
      "type": ["string", "null"],
      "description": "Timestamp review"
    }
  },
  "additionalProperties": false,
  "if": {
    "properties": { "decision": { "const": "revise_with_text" } }
  },
  "then": {
    "required": ["revised_text"],
    "properties": { "revised_text": { "type": "string", "minLength": 1 } }
  }
}
